{
  "schema_version": "1.0",
  "run_id": "RUN_20260312T115832Z",
  "sealed_at": "2026-03-12T12:09:51.337146+00:00",
  "files": {
    "bar_log_20240603.csv": {
      "sha256": "7ee1f1a6444bbcf1fd89847ed62b59d33fcb1ca4abd899b98ba6099283c52067",
      "size": 2499
    },
    "bar_log_20240604.csv": {
      "sha256": "59c2360ceedb2d04c4524f89bf6f83ff73397b367bd94bbf404dee2dadfad1f8",
      "size": 193459
    },
    "bar_log_20240605.csv": {
      "sha256": "baa1feada9e6c6546ca29d03fbc409082ea3c520e4ed242f0a0fd9e7c8980aa0",
      "size": 196008
    },
    "bar_log_20240606.csv": {
      "sha256": "02312eab28bb54563a9c3da6aa84759877a524196087fba1f3e542a2c168233f",
      "size": 194887
    },
    "bar_log_20240607.csv": {
      "sha256": "08227f4020f0e9d2d8a8a06f5b79a783f3650fb1cd86c62374eb266dde28b86e",
      "size": 194187
    },
    "bar_log_20240610.csv": {
      "sha256": "19011d4a54274217765882b1f37f864e4836ed04772f6a980b19b4e9673ab168",
      "size": 194610
    },
    "bar_log_20240611.csv": {
      "sha256": "c15543511dcca3ed195b37724ebac05f619a0c729ecc9326cec49c483ccdaf7a",
      "size": 194729
    },
    "bar_log_20240612.csv": {
      "sha256": "537748cd13aa7708033a759d7fd66338d4e461c8f259be32c48c740f9b7623b6",
      "size": 194686
    },
    "bar_log_20240613.csv": {
      "sha256": "5be970c0fd56527ac725fcfa7332f2c064005f44e780a634b6a3952d396ef505",
      "size": 194586
    },
    "bar_log_20240614.csv": {
      "sha256": "5e6f6705d4472f5862c8b04ff99932104d5adef493bb390e6721df3a96c67d8d",
      "size": 194411
    },
    "bar_log_20240617.csv": {
      "sha256": "1aad103afdfc17e413109357203f6490e8e554a272b0895c2e793f40fbd67056",
      "size": 194484
    },
    "bar_log_20240618.csv": {
      "sha256": "3d8eac1bfa8eaf8fdc23c24024bdbb9f01b7ae54398de9ebd04c13d1e4b32584",
      "size": 195174
    },
    "bar_log_20240619.csv": {
      "sha256": "4e2648426a2ccf507f6b8b1251ebd973b0b4e9fcfc960d3cca0d55efb5813950",
      "size": 163499
    },
    "bar_log_20240620.csv": {
      "sha256": "25fc2ffa0d4931f2c8acbeb3940b1b9b41871ca34086c765b05bb57f749afc0d",
      "size": 195230
    },
    "bar_log_20240621.csv": {
      "sha256": "a386bd38b2bdfd893b1ab7b1eb4c47d1de23afb6c87f602c71f540c525f013c2",
      "size": 194005
    },
    "bar_log_20240624.csv": {
      "sha256": "4cdb22b12f718db9b150af40771f546d669acb4d65764829efe5b52ebf5b97a8",
      "size": 195201
    },
    "bar_log_20240625.csv": {
      "sha256": "1de9749e6fcf72807b8215f05e3a1b3784902f697a5b6af6644528eac8e0e6c6",
      "size": 197389
    },
    "bar_log_20240626.csv": {
      "sha256": "4b89e37c26e79aeecbd987aa601cc0da08a8fcabd24fd80c73251f0f763138e1",
      "size": 196351
    },
    "bar_log_20240627.csv": {
      "sha256": "034cdc135f8abe555dfb7348168ddb7d26c6379538e45163a3fdbb04efeef703",
      "size": 195051
    },
    "bar_log_20240628.csv": {
      "sha256": "86eb44d68db238b1d72332fb520142fc9f954f4811f6e9278c32ee8686a027c5",
      "size": 194575
    },
    "bar_log_20240701.csv": {
      "sha256": "a4ddade4bb5a65d19fea9bc7d1037969ca5b5ddfc2d3a09bd09822e329403898",
      "size": 194635
    },
    "bar_log_20240702.csv": {
      "sha256": "56cc4eb8a3c56cef13e2cf61472c03d4fbabd43d44d91ec79a0080c300fe09b5",
      "size": 195459
    },
    "bar_log_20240703.csv": {
      "sha256": "a7462023e3d17fc3390c6297ecd7cd6691f0a3dfc08aa81293cc79e1993d03eb",
      "size": 163717
    },
    "bar_log_20240704.csv": {
      "sha256": "dc3293388f8768283453ebc29073031685a1a5b8e15da889010134c665e76b8a",
      "size": 162624
    },
    "bar_log_20240705.csv": {
      "sha256": "a32dae70ad3c671c16e9ab25c9f8931f4594c8593e8ae00d23b6b835c5ba2b60",
      "size": 196275
    },
    "bar_log_20240708.csv": {
      "sha256": "63519ac8bcd5a5df868609992b8d4d939084e98faa4770fc0de98325c06b2b8c",
      "size": 195265
    },
    "bar_log_20240709.csv": {
      "sha256": "19d3684cee470a6ef87084c6fa1acfad9805c28669269189c0c16e7b7a6745d0",
      "size": 194348
    },
    "bar_log_20240710.csv": {
      "sha256": "79d3f33468f0f4b4da38f2cafcd4e1dd19fd7c18d7ba3bf86ef4063dd6652f58",
      "size": 194598
    },
    "bar_log_20240711.csv": {
      "sha256": "9144783ca13fe95ce86671715936377fab7cb2afb9a077eb75cf4345565af751",
      "size": 195819
    },
    "bar_log_20240712.csv": {
      "sha256": "a0a6430132a8b56ada2c8162992040cc3879af94f6f5abf44741e5dfad51a8ea",
      "size": 194240
    },
    "bar_log_20240715.csv": {
      "sha256": "b283956e41ecfd45507c443e0cf62c42b2b44d0fc0e8185f067777e939ca154c",
      "size": 196434
    },
    "bar_log_20240716.csv": {
      "sha256": "0bc573c536001fb6122712b5fb0d3b9e6e00b786821a42047efb9bea9693ff8a",
      "size": 195119
    },
    "bar_log_20240717.csv": {
      "sha256": "678e6e3a06fd49ce8f810bada90e8aa3385f4606f020caae6bf205397727ecaa",
      "size": 196444
    },
    "bar_log_20240718.csv": {
      "sha256": "eb92067c7a510a9d3d19d480be9f4dca0d0deace7187dd49a61477ad670cc25f",
      "size": 195192
    },
    "bar_log_20240719.csv": {
      "sha256": "edce660a6ce7f9ec723cbba78c334aa90692a6b8d6186d2fcda0350e027445b5",
      "size": 194291
    },
    "bar_log_20240722.csv": {
      "sha256": "b7efc024c44ff2d79357aa73deaa2cb123d31185273a362c6e023fa51a31ca87",
      "size": 194801
    },
    "bar_log_20240723.csv": {
      "sha256": "04090db0094a8cfe193155dd38cacb363692e6a82264d505d9824523a771105b",
      "size": 194568
    },
    "bar_log_20240724.csv": {
      "sha256": "ed3a2c314dc145af96c46e2fdd36ec8a8e15e9ae77e4e58df8a2d7ba9992193d",
      "size": 195902
    },
    "bar_log_20240725.csv": {
      "sha256": "20b0cfdb25b505f63eec60ac48061b368c64dede27516f9e1fbf2d73717548c5",
      "size": 194825
    },
    "bar_log_20240726.csv": {
      "sha256": "70cade33ee0c638f600f1974c0e76c211c96da3bacfbab0b684571622af51d5f",
      "size": 194900
    },
    "bar_log_20240729.csv": {
      "sha256": "77571e2b34075f5b6d215735b145924b76b3adae95df2bb70bb2c06c61f420f1",
      "size": 194888
    },
    "bar_log_20240730.csv": {
      "sha256": "62af1fc75577d7d053e1b1cdbf5b167c65a6b455472e95cb35ef8d9aec654fcf",
      "size": 196354
    },
    "bar_log_20240731.csv": {
      "sha256": "9033510c2d900537b800d148045dead8b970ce4f5350aa9bed10c0b95f023f90",
      "size": 194962
    },
    "bar_log_20240801.csv": {
      "sha256": "ae2d98e97051d4e8e1cd9bff1f23206049b2390c7455e9d5132f6c7f65772998",
      "size": 195339
    },
    "bar_log_20240802.csv": {
      "sha256": "c1484f013e00eaffe4bcb5a47a50bdffd754a24f448785b3f56b51f9c6112b7c",
      "size": 194079
    },
    "bar_log_20240805.csv": {
      "sha256": "32f1bc93849a83bd7db0feabdbc525d835b2075b24874ceedada715c3b154976",
      "size": 195082
    },
    "bar_log_20240806.csv": {
      "sha256": "7a77a479b724a6ef7016532b3503fe785f6bb3fe906ee9f4f54e1a8598ca35d9",
      "size": 196010
    },
    "bar_log_20240807.csv": {
      "sha256": "e3a7c4c5d6be89a83c5344416f40f784ac507b6545622100f204e2ae06c68b1c",
      "size": 196078
    },
    "bar_log_20240808.csv": {
      "sha256": "6f4a2ed1907eee4e3d72bf36bd738b5e4c3a31dd1c3fbe021682127819822a49",
      "size": 195680
    },
    "bar_log_20240809.csv": {
      "sha256": "33f9f6e120a6e0e8980b871dd4782906afe24289c8025cb556a7254e1745f487",
      "size": 195453
    },
    "bar_log_20240812.csv": {
      "sha256": "3cabd744c888a4be5c8e3fbec8ec2d78b416f301ccd6a4a4fa834c7c81cc090d",
      "size": 194803
    },
    "bar_log_20240813.csv": {
      "sha256": "832e987793c833b583a966cd6c84bd059a4510521f58cd5cc35c97299113581e",
      "size": 196063
    },
    "bar_log_20240814.csv": {
      "sha256": "37157ed73b3d7391a68991357ab7c4df376142b3ab588096f900444f50dd21a1",
      "size": 193590
    },
    "bar_log_20240815.csv": {
      "sha256": "7e44c3b9c5815c2481d10bcd3c069aafec8b10f76225d4ca0395fff6105f320a",
      "size": 197339
    },
    "bar_log_20240816.csv": {
      "sha256": "33a6ca704488f2d07a09d74ce2ffba8142b52da95fd31b10562d87be875c8c12",
      "size": 195217
    },
    "bar_log_20240819.csv": {
      "sha256": "d90322f3fac0116925eca0bf541493b7c16e55efe6f436e15985a4a07c574f88",
      "size": 193954
    },
    "bar_log_20240820.csv": {
      "sha256": "5ef4bf370ca930df63a5e7424bae49e0a25f0cbd5ad1a25099900c1513fc7f0c",
      "size": 196365
    },
    "bar_log_20240821.csv": {
      "sha256": "8d2239f770138af65a686a1b90ea09e757198deb847fe1fd0cbfa25966432522",
      "size": 194426
    },
    "bar_log_20240822.csv": {
      "sha256": "209160097b0c3a552decc137cdd6d8d63e244df33d1caf65bd3b93cdff1d71d0",
      "size": 197021
    },
    "bar_log_20240823.csv": {
      "sha256": "6c0df928f0149c41b092c1babe99ea1b796c0756842cef2dcd1ea3e71936379f",
      "size": 193278
    },
    "bar_log_20240826.csv": {
      "sha256": "0394e80432299ed1fce76f3676c78f3be78155ba5b2fc82bddfbdaffe3cbe64e",
      "size": 195947
    },
    "bar_log_20240827.csv": {
      "sha256": "710cbcb78387dd9f99ef9280e1bcd518f5d88051a4784a769f05d18197e3f7e4",
      "size": 194848
    },
    "bar_log_20240828.csv": {
      "sha256": "2bcfde7af6b751bfaa86f608f19934c1e8117255b7195cef1e299ef132920016",
      "size": 195241
    },
    "bar_log_20240829.csv": {
      "sha256": "3766affee3f48856f8352d5a300e8bcceb076904073a8a995857f330f772df1f",
      "size": 195190
    },
    "bar_log_20240830.csv": {
      "sha256": "ba8a999d73f2ce2472cc3fe2c3aca14b965e02c367a059351183bcda51cf2d58",
      "size": 194312
    },
    "bar_log_20240902.csv": {
      "sha256": "03d5b9733e3e649d050cd0533c500aa7b4e62bea4370c1180b3c730eb6a70190",
      "size": 163636
    },
    "bar_log_20240903.csv": {
      "sha256": "06a4004e209750e20f763fe07cec2fc552865e4a4f080ede3c38bfd84a188c6d",
      "size": 195834
    },
    "bar_log_20240904.csv": {
      "sha256": "8ca1b8db3d8fc0f13795b5bb83af1373f21531e5dee93f74a1693030784606cc",
      "size": 194770
    },
    "bar_log_20240905.csv": {
      "sha256": "a14f67217814fc98817aeb50a7df63fbe9143cee869bf14b8c8c79678173aeec",
      "size": 194881
    },
    "bar_log_20240906.csv": {